Company Name,Esablished,Total Projects,About Company
Riddhi Group,2013,16,"Riddhi Builders is a real estate company based in Hyderabad.
Our credibility in this field is evident from the number of successful projects handled by us in the past decades. Ours is a company with ideas.
Ideals which have shaped our journey and given us an impetus to work towards being acknowledged as the most credible company in this business. We are renowned for our superiority in the fields of quality constructions and locations. Our constant endeavors are aimed at providing the best quality living to all strata of the society without any compromise on quality. In addition to high flying constructions for the elite, we are also into the construction of affordable and visually charming homes complete with all conveniences.",
Vessella Group,2010,2,"Vessella Group is a name that has brought a vast revolution in the Real Estate market. This company has been working hard since the year of its inception to fulfil the dreams of millions of people. They do not just aim in making money; they always focus on customer satisfaction and ensure that their clients and customers are provided with excellent services. Apart from this, Vessella Group also provides after sale services along with 24 hours customer care support, which makes them completely different from other builders in the market.",
Jaydee Group,2001,2,"JAYDEE group has swiftly carved 18 years of substantial growth, customer satisfaction and innovation. We have successfully completed residential cum commercial projects at Vavol. Such as...."
Omkar Group,2001,4,"Omkar Group is totally committed to give shape to your dream home. The foundation of this company is built on high quality, customer satisfaction, timely delivery and most importantly ethics. Known for the superior quality and time adherence, the company has delivered residential spaces in Gandhinagar, Vastral, Narol, Vatva, Isanpur, Ranip, Bareja which amounts to more than 5000 Units and a lot more is projected to be completed in years to come. Omkar Group mainly focuses on affordable housing and commercial projects.",
Soham Group,9,"Soham Group is now a name renowned for its quality in the skyline of Ahmedabad. It is steered by a group of professionals having over twenty years of experience in the real estate industry. After developing a class of commercial and residential spaces over the years, we are now in the expansion of our portfolio towards ultra-luxurious residences, hi-tech commercial spaces, concept-colonies, hotels and the tandem that a changing megacity demands.",
