Company Name,Esablished,Total Projects,About Company

Sumadhura Infracon Pvt. Ltd.,1998,42,"Sumadhura Infracon Pvt Ltd is a name that resonates among the prominent residential and commercial developers in Bangalore, India. Their ability to deliver on-time luxurious and affordable housing projects in Bangalore has ensured a continual interest from their customers. Their expertise in acquisition of land, appointment of architects and designers, construction, sales to after sales service, has helped them to be counted among Bangalore's forerunners in Real Estate development. The company's vision to continuously expand the role of a leading developer in the construction industry by building lasting relationships with our clientele and all concerned on the foundations of performance, trust and confidence. And its mission is to develop quality properties based on realistic values for its owners, investment affiliates, as well as its joint venture partners. It is an enterprise that maintains the highest level of personnel support and skilled professionals for an enjoyable environment.",
T.G. Developers,2012,9,"T.G. Developers has earned good reputation and trust through its core values since its inception over half a decade ago. The team of professionals ensure that every project goes through phases of rigorous planning and strategies, efficient construction methods without compromising on quality. Driven by strong leadership and experienced team they have laid the foundation of the company to the next level in the Real Estate industry. The team ensures that every concept matches the wave length of new age construction to meet customer's satisfaction. They believe in implementing innovative ideas that are completely blend with high end features and current trends to deliver beautiful residential spaces. All projects are ready to serve clients with world class facilities with some unique features that will fulfill their dream of owning a beautiful home. ",
Gopalan Enterprises,1984,34,"Gopalan Enterprises, one of the founding fathers of the real estate sector in Bangalore, is an established name in the industry for more than three decades.	 	 
Since its inception in 1984, Gopalan Enterprises has specialized in providing quality homes that perfectly balance the ever-morphing aesthetic aspirations and the functional needs. In the last three decades, this Rs 1500 crore company has diversified its portfolio to gain expertise in urban development through design, construction, maintenance and marketing of Residential complexes, Tech Parks, SEZs, Malls, Schools, Colleges, Organic Farming, Skill building and now Aerospace.	 	 
Mr. C. Gopalan, the Founder, and Director of Gopalan Enterprises is an accomplished architect from the reputed JJ School of Arts, Mumbai. He is accompanied and assisted by his sons Mr. C Pramod and Mr. Prabhakar, both also highly trained architects. Mr. Gopalan’s quest is to provide his home city, Bangalore, with construction that is made timeless by its designs, amenities, and quality.	 	 
Gopalan Enterprises had its beginnings in the residential sector, with an aim to create spaces that enable the customers the comfort and the convenience that they seek. The business is built on a foundation of integrity that inspires trust. With a keen sense of innovation in all that we do, Gopalan Enterprises has delivered projects on time. This has, thereby, ensuring a positive, deep relationship with the customer that lasts beyond a single purchase.	",
Celebrity Structures India Pvt Ltd	,2001,5,"Celebrity Structures India Pvt Ltd is a group managed in the able guidance of a team that is passionate and committed to deliver quality homes to customers while adding that extra dimension of lifestyle and consistent investment returns. With several completed and ongoing projects in Bangalore and Hyderabad, Celebrity Structures India Pvt Ltd., is fast emerging as one of the premium developers in South Bangalore. Their engineers and supervisors are trained to give clients the very best.
With over a decade of experience in property development with fourteen residential projects completed so far in Hyderabad & Bangalore and many more coming up in near future; this group is on its way to create a new paradigm in the real estate sector. Their strength is their team work and dedication. They build lasting relationships, not just homes. Their buildings are testaments to meeting their needs, fulfilling requirements and offering the best in construction.",
Bren Corporation,2001,14,"Bren Corporation takes to you supreme luxury mutual with a lifestyle that holds recent trends while providing an excellence experience. There residential projects are

extended across the technological and commercial centers of Bangalore. They build with the

finest materials. Their world class amenities combined with the best of stylish design make them

one of the finest builders today. Moreover, their customer service officials facilitate a hassle-free

procedure that confirms you make the best choice and understand your vision of having a

home. With an experience that expanses back four decades, the Bren Corporation has been developing

infrastructure that energies development and financial growth. Whether it's a home, a highway or high rise office space, the choice to capitalize requires unbiased assessments of plan,

construction quality, finish, and timely delivery.",
GP Homes,2010,25,"GP Homes has become a leading player of real estate in such a short span. It has become successful in carving its name in the construction industry. It is a company that exhibits excellence in everything it builds. GP Homes have marked a niche for themselves in the market, with their exceptional edifices, built entirely to customers satisfaction. They believe in maintaining clarity in communication, providing clear title and has been associated with transparent transactions. The company have focused on creating homes that foster a comfortable and wonderful living environment. They are young and dynamic builders. Their experienced and enthusiastic team of professionals specializes in identifying the exact need of the society and creating the most desired products.
",
KVT Homes and Estate PVt Ltd,1999,4,"Kvt Is A Trusted Realtor Company. We Are A Name Synonymous Within Chennai City And Pioneers In Land Development And Promotion, Since 1978. Our Company Is Pillared By Over Four Decades Of Experience In Unique Approach Of Planning And Designing. We Invest Heavily To Ensure That Our Development Surpass The Industry Benchmark. Our Focus Has Been On Environment Friendly Concepts On Transforming The Land Into Well Planned Urban Communities. Till Date, We Have Completed 31+ Land Mark Projects. Approximately 400 Acres Of Land Has Been Successfully Developed And Promoted Within Chennai City Limit Only. Today Kvt Group With A Huge Land Bank That Takes Pride Being A Premier Real Estate Developer, It Is Only The Persistent Confidence Of The Customers, Friends And Well-wishers That Has Made Kvt Group Flourish In The Business At All Times And That Has Successfully Turned The Dreams Of Investors And Customers Into Reality. Thanks To The Valued Customers, Friends, Well-wishers And Staff Who Have Constantly Reposed Their Confidence In Kvt Group.",
Ruby Builders And Promoters,1997,23,"Ruby Builders is known as one of the leading real estate and construction companies in Chennai. Conformed as an ISO 9001-2008 certified company, the firm has achieved business excellence by showing consistency in the standard of construction services. Their portfolio comprises of building artistic residences, commercial hubs and apartments. The firm wishes to build the strong relationship with their clients by leveraging upon latest technology, cost effective strategies and modern machinery. Their passion for hard work and unbeatable services has led the Ruby Builders through series of success. As the industry transforms into an economic stimulus triggering huge employment opportunities, the Ruby Builders refrain is capacity building and sustainable competitive advantage generated by its high-valued, unique and non-substitutable work force with high performance work systems.",
BSCPL Infrastructure Ltd,1982,20,"BSCPL Infrastructure Ltd is an infrastructure development company who are pioneers in

execution of road projects, irrigation projects and recently diversified into Real estate and

Hydro Power plants. They have executed several prestigious projects across India and abroad

including Afghanistan & Bangladesh. The experienced and visionary team of promoters, high

degree of mechanization with skills in the state of the art technology, professionally qualified

and experienced project managers and strong and stable workforce who can execute projects

under adverse conditions, the ability to forge partnerships wisely and the practice of

executing projects on their own has enabled BSCPL to emerge as a strong partner in the

process of building the lifelines of nations. BSCPL Infrastructure Ltd aim at creating a

community perfect for your needs and wants—informed, effortless, and enjoyable. They have

earned a reputation for consumer trust through their passionate commitment to deliver the

best quality residential spaces at a fair price.",
Golden Homes,1986,150,"GOLDEN HOMES PRIVATE LIMITED was established in the year 1986. Backed by a dedicated team of professionals, strong capital base and extensive experience, GOLDEN HOMES primarily focuses on the residential sector.

 

GOLDEN HOMES PRIVATE LIMITED is widely recognized for its pioneering role as a residential developer in Chennai having set new standards in the housing and urban development, promoting residential apartments  in Chennai and providing world-class amenities and infrastructure in its projects.

 

GOLDEN HOMES firmly believes that the best of today can be beaten and improved upon. Constant effort to surpass the past success and quality standards, willingness to continuously learn and improve, is the spirit behind the conception, design and creation of our projects.

 For 33 years, GOLDEN HOMES has been delivering beautiful homes following very high professional standards. Every GOLDEN HOMES project is executed with the same passion and the same commitment that has been the hallmark of the company. GOLDEN HOMES has delivered over 150 projects to over 3500 satisfied families. GOLDEN HOMES presently has close to 5 million square feet of residential projects at various stages of planning and execution. ",
India Builders Limited,1987,275,"India Builders Limited is a renowned and widely trusted property development group of companies involved in constructions in Chennai. They are a premium builder in Chennai, reputed in providing all their customers functional and aesthetically pleasing apartments, complemented by grandiose exteriors built using the latest innovative technology along with a wholesome of essential amenities. The company uses international quality standards which has earned them ISO 9001 certification. The company ensures of providing complete customer satisfaction, they have established a benchmark as the ideal flat promoters in Chennai, Coimbatore that’s unique in the industry. The core of their business process is the unswerving righteousness and disciplined work ethic that provides the necessary impetus to keep the passion alive. ",
GPS Group,1984,59,"The GPS Group is one of the largest, most innovative, creative and forward thinking Real Estate Company in Kolkata. The core business philosophy is a commitment to extraordinary service, honesty & clear communication. They launched as GM Group in 1984 and after 32 years in the industry, they opened its second full service office as GPS Group in Dwarka Vedmani, AD-169, Salt Lake City, Sec-1, Kolkata-700064, in order to better serve our clients. Mr.G.P.Gupta, belongs to a reputed business family, started career in Real Estate Sector in 1984 and constructed many multistoried residential & commercial building complex over the years. He is the first Developer in Keshtopur. Mr.Sanjay Gupta, has in excess of 20 of experience in the engineering & construction industry. He joined as the Director with responsibility to Business Development and Operations coordination. His experience encompasses all phases of project delivery including project manager, site management, project controls & estimating. Above all of this-the office, the technology, the history would be nothing without their people. At the Core of every successful Real Estate transaction they are the key persons who bring it all together. Their team is trained and they bring with them a wealth of experience and knowledge not just about real estate, but about life in general. Their staffs are passionate about what they do, and they take their jobs seriously. At the GPS Group, they go the extra mile to make their customers happy. They not only satisfying their customers, but they delight them.
",
EDEN GROUP,1908,10,"The Eden Group is committed to delivering great value to our customers in Kolkata.

Over the year the group has built a formidable reputation in the realty business. A huge focus on meticulous planning, attention towards architectural nuances and reliance on cutting edge technology has helped deliver outstanding products to hundreds of satisfied customers.

The management at Eden Realty has a latent energy and confidence owing to professionalism which has resulted in enviable working efficiency.  Ultimately all efforts are directed towards one motto… of achieving higher levels of customer satisfaction.",
GM Group,1984,59,"GM Group has strive to achieve excellence in the field of construction, real estate and construction management in Kolkata. The principal activity of the Group is development of residential and commercial buildings. Since its inception, GM Group has given the best value and quality to its clients. The Group effectively helps those looking for excellent properties to achieve their goals because of its outstanding construction management experience. This Group has teamed with its clients for the biggest building challenges while offering cost saving and personal attention. The search for best value of construction and allied services by the most discerning client ends at GM Group.",
Realtech Nirman Pvt. Ltd.,1994,19,"Having created and delivered many quality projects across Kolkata, Realtech Nirman Pvt. Ltd., has established itself as one of the most trusted names in the Real estate industry. It has carved a niche for itself by developing residential/commercial projects that speak of class. It has a strong vision of providing quality residences for all those who dream of owning a house. Realtech Nirman Pvt Ltd is a modern day construction industry that focuses on the beautiful combination of convenience and elegance in all their projects.
",
Sree Balaji,2001,3,"We are one of the leading developers of residential and commercial projects in West Bengal. Since inception, we have always endeavoured to offer our customers their dream homes  at an affordable price. Sree Balaji Group has always conducted itself  with clear principles and ethics, transparency, customer service with a view to providing a  quality residential experience to our customers. 

Our range of expertise encompasses a holistic management of all aspects of a project right from the acquisition of land, appointment of architects and designers, construction, sales to after sales service. The company’s projects are located in the most desirable and exclusive locations and homes are built under high quality specifications that have become synonymous with the group. In addition to support services provided by our team, the company’s comprehensive customer care program ensures total customer delight. 

Sree Balaji was founded by Mr. MANAB PAUL , a first generation entrepreneur with a vision to build world class residential and commercial spaces that create a better and more humane living and working environment. Customer delight and concern for the environment are two key driving principles at Sree Balaji.

Over two decades of experience and expertise have paved the way for SREE BALAJI to emerge as a leading construction developer company. Started in 2006 the company specialises in developing, building and marketing various construction projects that find varied usage in the civil construction and building industry.",
Merlin Group,1984,101,"Nation wide presence for the last 33 years | Over 10 million sq ft of construction experience | Over 500 acres of land bank across India | Over 100 projects completed | Over 50% sales from referrals (Existing customers) | At present, over 7.5 million sq ft of construction in progress | Co-promoter of South City Group. Merlin Group, Over three decades of leadership in the East. Kudos galore in Real Estates. Now it's time to spread our wings. Touch lives. Build the Nation the Merlin Way. Over 2.5 million sqft. of construction work in progress in Kolkata and around 5 million outside Kolkata, in Chennai, Ahmedabad, Raipur, Pune and Bhubaneswar. Creating a new Horizon ! Merlin Group, is one of the leading and premium real estate developers in India, having to its credit, over the past three decades, number of prestigious Residential and Commercial Complexes, Office Buildings and Township in Kolkata, Ahmedabad, Raipur, Chennai and has now also extended its activities to Modern Shopping Malls, Resort, Industrial Estate & Clubs etc."
Royal Realtors Group Of Companies,2006,5,"Established in 2006 by three visionary founders, Royal Realtors Group has developed 1 million square feet of real estate and completed 7 projects across Mumbai suburbs in its journey so far. Presently, we are developing another 1 million sq. ft. across two projects.
Sustainable approach, exceptional design and latest technologies are the hallmarks of our projects . We understand the needs of an ever-evolving lifestyle in an urban landscape, and design spaces that are intelligent enough to meet the aspirations of the new age customer.
We constantly strive to offer an outstanding customer experience. Our high-quality construction, transparent sales process and thorough post-sales service are a testimony to that.",
Romell Group,1996,20,"Romell Group is the patron name in the field of real estate. The firm aims to endow people with modern generation homes. The group since its time of inception focuses on achieving customer satisfaction and maintaining high quality of property with unmatched services. The team is armed with their wide and innovative skills. The well-knit team comprises of engineers,
architects and designers who work relentlessly to maintain the reputation of the company. Each of the projects created by them are unique and magnificent, thus carving a niche in the realty domain.",
Unique Shanti Developers ,1995,108,Unique Shanti Developers Pvt Ltd is a leading name in the Real Estate field. The firm is an apex of comfortable and modern adobe providers. Their wide imagination and creativity makes them one of the well-known Real Estate companies in the market. They have a group of skilled and experienced craftsman and architects who keep on innovating new designs and ideas for the construction of premium structures. They ensure to provide residents with all the modern amenities and luxuries. They believe in establishing long term relationship with their clients and not just simply focus on making money. Their dedication and quality services have assisted them in reaching the edge of success where they are standing today.,
Ajnara India Ltd.,1991,10,"Ajnara India Ltd. is a renowned name in the Real Estate sector with an experience of almost two decades guiding through its growth. Delhi, Noida, and NCR being its center of operations, Ajnara has successfully completed various projects, both residential and commercial in nature, on land acquired from DDA, GDA & Noida Authority through bidding and auctions. In all ventures so far completed, Ajnara has proved its dedication towards quality, design, and construction. At Ajnara, great emphasis is laid on the aesthetics and utmost care is taken to ensure that all the undertakings are architecturally soothing to the sense. Appeal and affordability are the characteristics of Ajnara, and the company is also proud of its commitment.",
Renowned Group,2009,2,Renowned Group is approaching very rapidly in their path of success through their sincere attempts to have something big to their clients. In the entire domain of Real Estate there are very few companies like Renowned Group who wants to unite their passion with customer satisfaction. The group has been maintained and organized by the persons who have their first hand experience to deal with every problem that would come into their path of success. Unique and complete construction is their motto and strong team and sound financial background is their stepping stone of their success.,
Dasnac,1986,125,"WE ARE DASNAC 
32+ Years Of Experience
125+ Projects Across North India
15+ Million Sq .Ft. of Real Estate Delivered
6,000+ Homes Delivered 

ENGINEERING & ARCHITECTURE
Dasnac’s predecessor and flagship business, Designarch has been a leading engineering and architectural firm in India for over two decades. We have
successfully completed over 100 residential, commercial, education and healthcare projects of over 15 million sq. ft. 

STRATEGIC INVESTMENTS
Dasnac makes strategic investments in real estate and impactful ventures across sectors and geographies. Within real estate we concentrate on opportunistic value-addition in the built environment and land. We see urbanization in th developing world as an immense opportunity and evaluate opportunities around this theme for private investments.  

BUILDING CONSTRUCTION
Dasnac, equipped with a long-standing engineering and architectural tradition, is capable of managing and executing construction of its projects at the cutting-edge with our construction division.

NURTURING ENTERPRISE WITH A PASSION TO CREATE CHANGE FOR POSITIVE HUMAN IMPACT
We presently have interests in businesses focused on innovative and meaningful value creation across the real estate value chain. With experience spanning three decades and over 15 million sq ft. of property, we have acquired expertise across development engineering, architecture, and building construction. In addition, we make strategic investments in real estate and impactful ventures across sectors and geographies. 

PROPERTY DEVELOPMENT
Dasnac is a knowledge-driven leader in property development in North India. Our flagship business, Designarch, pioneered smart housing in South Asia. We develop properties selectively with unrelenting focus on quality",
Cybercity Builders & Developers,2008,3,"Cybercity Builders and Developers Pvt. Ltd. are a leading and famous Real Estate company based in the Southern part of the country. Employees of this company are highly educated, skilled and qualified individuals. Additionally, they also undergo rigorous training to further enhance their knowledge and expertise. This is the reason why Cybercity Builders and Developers are so renowned and successful. These employees consist of engineers and architects who unite to deliver superior quality services. The residential and commercial complexes they construct are top notch and in terms of quality they are excellent. Creativity, innovation and hard work has contributed immensely to the success of this company.",
Anuhar Homes Pvt Ltd,2007,21,"Anuhar Homes is the first proficiently managed builder in the city. They have been in the industry of real estate for many years. They strongly believe in providing satisfied and quality living spaces in the happening locations of the city, thus bringing their customers dream to reality. They are
known to build the best homes and with their quality and perfection, have been able to win
the hearts of the people.",
RR Builders,2006,17,"RR builders is an eminent real esate builder who have delivered the best in class apartments across Hyderabad. Since inception in 2006, they have endeavored to be the most preferred home builders. RR Builders believes that home is a sacred place, to be built not just using bricks and stones but on trust, faith and integrity."
Praneeth Group,2007,9,"Praneeth Group is an established real estate development group at Hyderabad, Andhra Pradesh, India. They are a group of Information Technology professionals with a zeal for providing enhanced services to the customers, and bring a difference to real estate sector in India. The group holds a reputation of premier real estate company in Hyderabad with bigger and challenging projects added every year. Over the years, the group is actively involved in constructing world class environment accompanied by the horde of modern features and amenities. With a clear vision of providing the best, they are in the process of developing gated communities & mega townships which include apartments and residential enclaves. Focusing equally on building up of Malls & Multiplex, they have raised the name in terms of commercial construction. Praneeth Group have successfully built and handed over more than 1 million Square feet to their esteemed clientele over last seven years.",
